,group,group_id,name,homepage,description,category,projectrank,show,monthly_downloads,release_count,created_at,updated_at,projectrank_placing,labels,trending,github_id,conda_id,pypi_id,pypi_url,pypi_monthly_downloads,conda_url,conda_latest_release_published_at,conda_total_downloads,npm_id,maven_id,npm_url,npm_monthly_downloads,maven_url,cargo_id,cargo_url,cargo_monthly_downloads,cargo_total_downloads,go_id,go_url
0,True,eth,ETH - Ethereum,https://github.com/ethereum,Decentralized platform for applications. Applications build on it can use smart contracts - computer algorithms which..,smart-contract-platform,12,True,39233208.0,61.0,2020-08-27 02:23:15.253,2023-07-28 16:37:14.379,1.0,,,,,,,,,,,,,,,,,,,,,
1,True,btc,BTC - Bitcoin,https://github.com/bitcoin,"Cryptocurrency and worldwide payment system. It is the first decentralized digital currency, as the system works..",cryptocurrency,8,False,22324701.999999996,,,,1.0,,,,,,,,,,,,,,,,,,,,,
2,True,near,NEAR - Near,https://github.com/near,"Sharded, developer-friendly, proof-of-stake public blockchain, built by a world-class team that has built some of the..",smart-contract-platform,8,False,5835228.0,,,,1.0,,,,,,,,,,,,,,,,,,,,,
3,True,sol,SOL - Solana,https://github.com/solana-labs,"Public blockchain. It is open-source and decentralised, and achieves consensus using a proof-of-stake algorithm..",smart-contract-platform,8,False,4977307.333333333,,,,1.0,,,,,,,,,,,,,,,,,,,,,
4,True,dot,DOT - Polkadot,https://github.com/paritytech,Network protocol that allows arbitrary datanot just tokensto be transferred across blockchains. This means Polkadot is..,smart-contract-platform,8,False,3531776.0,,,,1.0,,,,,,,,,,,,,,,,,,,,,
5,True,uni,UNI - Uniswap,https://github.com/Uniswap,"Governance token for Uniswap, an Automated Market Market DEX on the Ethereum blockchain. The UNI token allows token..",amm,8,False,3936840.0,,,,1.0,['eth'],,,,,,,,,,,,,,,,,,,,
6,True,algo,ALGO - Algorand,https://github.com/algorand,"Algorand removes the technical barriers that for years undermined mainstream blockchain adoption: decentralization,..",cryptocurrency,7,False,678982.0,,,,1.0,,,,,,,,,,,,,,,,,,,,,
7,True,xlm,XLM - Stellar,https://github.com/stellar,Open platform for building financial products that connect people everywhere. Stellar blockchain enables near instant..,cryptocurrency,7,False,588604.0,,,,1.0,,,,,,,,,,,,,,,,,,,,,
8,True,trx,TRX - TRON,https://github.com/tronprotocol,TRON: Decentralize the Web TRON is dedicated to building the infrastructure for a truly decentralized Internet. The..,smart-contract-platform,7,False,482858.0,,,,1.0,,,,,,,,,,,,,,,,,,,,,
9,True,eos,EOS - EOS,https://github.com/eosio,Cryptocurrency token and blockchain that operates as a smart contract platform for the deployment of decentralized..,smart-contract-platform,7,False,646584.0,,,,1.0,,,,,,,,,,,,,,,,,,,,,
10,True,clny,CLNY - MarsColony,https://github.com/JoinColony,Hybrid token that contains attributes of government and utility tokens. Token holders can use this token to take part..,others,7,False,661692.0,,,,1.0,['one'],,,,,,,,,,,,,,,,,,,,
11,True,ens,ENS - Ethereum Name Service,https://github.com/ensdomains,"The Ethereum Name Service (ENS) is a distributed, open, and extensible naming system based on the Ethereum blockchain...",metaverse,7,False,745610.0,,,,1.0,['eth'],,,,,,,,,,,,,,,,,,,,
12,True,srm,SRM - Serum,https://github.com/project-serum,Worlds first completely decentralized derivatives exchange with trustless cross-chain trading.,exchange-tokens,7,False,1534585.3333333335,,,,1.0,['eth'],,,,,,,,,,,,,,,,,,,,
13,True,xch,XCH - Chia,https://github.com/Chia-Network,"Founded by Bram Cohen, the inventor of the BitTorrent network, Chia Network is building a better blockchain and smart..",smart-contract-platform,7,False,1432282.0,,,,1.0,,,,,,,,,,,,,,,,,,,,,
14,True,xrp,XRP - XRP,https://github.com/ripple,"Ripple (XRP) is one of the fastest and most scalable digital asset, enabling real-time global payments anywhere in the..",cryptocurrency,6,False,411582.0,,,,1.0,,,,,,,,,,,,,,,,,,,,,
15,True,luna,LUNA - Terra,https://github.com/terra-money,A stable foundation for the future of decentralized finance.,defi,6,False,161820.0,,,,1.0,,,,,,,,,,,,,,,,,,,,,
16,True,avax,AVAX - Avalanche,https://github.com/ava-labs,Open-source platform for launching decentralized finance applications and enterprise blockchain deployments in one..,smart-contract-platform,6,False,220278.0,,,,2.0,['avax'],,,,,,,,,,,,,,,,,,,,
17,True,matic,MATIC - Polygon,https://github.com/maticnetwork,Matic Network brings massive scale to Ethereum using an adapted version of Plasma with PoS based side chains.,smart-contract-platform,6,False,60106.0,,,,2.0,['eth'],,,,,,,,,,,,,,,,,,,,
18,True,link,LINK - Chainlink,https://github.com/smartcontractkit,"The LINK Network provides smart contracts with data, bank payments and access to APIs.",web3,6,False,182876.0,,,,1.0,['eth'],,,,,,,,,,,,,,,,,,,,
19,True,atom,ATOM - Cosmos,https://github.com/cosmos,"Decentralized network of independent parallel blockchains, each powered by BFT consensus algorithms like Tendermint..",cryptocurrency,6,False,183757.3333333333,,,,1.0,,,,,,,,,,,,,,,,,,,,,
20,True,sushi,SUSHI - Sushi,https://github.com/sushiswap,"DeFi protocol that is completely community-driven, serving up delicious interest for your held crypto assets. On..",amm,6,False,127638.0,,,,2.0,['eth'],,,,,,,,,,,,,,,,,,,,
21,True,icp,ICP - Internet Computer,https://github.com/dfinity,Worlds first blockchain that is capable of running at web speed at unrestrictive capacities. Built by the DFINITY..,smart-contract-platform,6,False,111688.66666666667,,,,2.0,,,,,,,,,,,,,,,,,,,,,
22,True,hbar,HBAR - Hedera,https://github.com/hashgraph,Decentralized public network for you to make your digital world exactly as it should be yours. Whether youre a startup..,exchange-tokens,6,False,326932.0,,,,1.0,,,,,,,,,,,,,,,,,,,,,
23,True,fil,FIL - Filecoin,https://github.com/filecoin-project,The Filecoin network achieves staggering economies of scale by allowing anyone worldwide to participate as storage..,web3,6,False,103059.33333333336,,,,1.0,,,,,,,,,,,,,,,,,,,,,
24,True,mana,MANA - Decentraland,https://github.com/decentraland,"Decentraland will be a virtual reality platform powered by the Ethereum blockchain. Users can create, experience, and..",metaverse,6,False,108610.0,,,,1.0,['eth'],,,,,,,,,,,,,,,,,,,,
25,True,ar,AR - Arweave,https://github.com/ArweaveTeam,A new data storage blockchain protocol based on a novel proof of access consensus mechanism that creates truly..,web3,6,False,347188.0,,,,1.0,,,,,,,,,,,,,,,,,,,,,
26,True,flow,FLOW - Flow,https://github.com/onflow,"Fast, decentralized, and developer-friendly blockchain, designed as the foundation for a new generation of..",metaverse,6,False,122672.0,,,,1.0,,,,,,,,,,,,,,,,,,,,,
27,True,stx,STX - Stacks,https://github.com/blockstack,New decentralized internet where users own their data and apps run locally. A browser portal is all thats needed to..,web3,6,False,392730.0,,,,1.0,,,,,,,,,,,,,,,,,,,,,
28,True,celo,CELO - Celo,https://github.com/celo-org,"A platform for fast, secure, stable digital payments to any mobile number at a fraction of todays cost.",cryptocurrency,6,False,269946.0,,,,1.0,,,,,,,,,,,,,,,,,,,,,
29,True,snx,SNX - Synthetix Network Token,https://github.com/Synthetixio,Synthetix Network Token will be a decentralised payment network where users transact directly in a price-stable..,defi,6,False,179394.0,,,,1.0,['eth'],,,,,,,,,,,,,,,,,,,,
30,True,scrt,SCRT - Secret,https://github.com/scrtlabs,"Native coin of the Secret Network, the first blockchain that enables general-purpose private / secure computation...",privacy-coins,6,False,101914.0,,,,1.0,,,,,,,,,,,,,,,,,,,,,
31,True,gno,GNO - Gnosis,https://github.com/gnosis,Gnosis builds revolutionary market-driven forecasting technology to let you shape the future.,exchange-tokens,6,False,90008.0,,,,1.0,['eth'],,,,,,,,,,,,,,,,,,,,
32,True,maid,MAID - MaidSafeCoin,https://github.com/maidsafe,"Blockchain based storage solutions that store a data identifier (e.g. hash) in a blockchain, but store the data..",web3,6,False,171392.6666666666,,,,1.0,,,,,,,,,,,,,,,,,,,,,
33,True,nim,NIM - Nimiq,https://github.com/nimiq,Blockchain designed for simplicity. Nimiq aims to be the best performing and easiest-to-use decentralized payment..,others,6,False,262046.6666666667,,,,1.0,,,,,,,,,,,,,,,,,,,,,
34,True,neo,NEO - NEO,https://github.com/neo-project,Non-profit community-based blockchain project that utilizes blockchain technology and digital identity to digitize..,smart-contract-platform,5,False,15166.0,,,,2.0,,,,,,,,,,,,,,,,,,,,,
35,True,icx,ICX - ICON,https://github.com/icon-project,ICON wants to be one of the largest blockchain networks in the world. ICON will boast independent blockchains..,smart-contract-platform,5,False,8696.0,,,,2.0,,,,,,,,,,,,,,,,,,,,,
36,True,aave,AAVE - Aave,https://github.com/aave,Decentralized Lending on Ethereum Network - Lending Ethereum.,defi,5,False,11300.0,,,,1.0,['eth'],,,,,,,,,,,,,,,,,,,,
37,True,cake,CAKE - PancakeSwap,https://github.com/pancakeswap,"Automated market maker (AMM) that allows two tokens to be exchanged on the Binance Smart Chain. It is fast, cheap, and..",amm,5,False,24550.0,,,,3.0,['bsc'],,,,,,,,,,,,,,,,,,,,
38,True,zec,ZEC - Zcash,https://github.com/zcash,Decentralized and open-source cryptocurrency that provides strong privacy protections. Shielded transactions hide the..,privacy-coins,5,False,30152.666666666664,,,,1.0,,,,,,,,,,,,,,,,,,,,,
39,True,dash,DASH - Dash,https://github.com/dashpay,The project was initially released under the name XCoin (linking the identifier XCO to the monetary amounts..,cryptocurrency,5,False,10916.0,,,,2.0,,,,,,,,,,,,,,,,,,,,,
40,True,udt,UDT - Unlock Protocol,https://github.com/unlock-protocol,No description.,others,5,False,12984.0,,,,1.0,['eth'],,,,,,,,,,,,,,,,,,,,
41,True,aleo,ALEO,https://github.com/AleoHQ,No description.,others,5,False,39764.666666666664,,,,1.0,,-1.0,,,,,,,,,,,,,,,,,,,
42,True,vet,VET - VeChain,https://github.com/vechain,Worlds leading blockchain platform offering Blockchain-as-a-Service to enterprises for products and information. By..,iot,5,False,17200.0,,,,1.0,,,,,,,,,,,,,,,,,,,,,
43,True,klay,KLAY - Klaytn,https://github.com/klaytn,"Public blockchain platform of the leading South Korean mobile platform, Kakao. Dedicated to validating the value and..",others,5,False,35014.0,,,,1.0,,,,,,,,,,,,,,,,,,,,,
44,True,miota,MIOTA - IOTA,https://github.com/iotaledger,"Open-source distributed data logging technology, which aims to securely enable the exchange of information and value..",iot,5,False,19037.333333333336,,,,1.0,,,,,,,,,,,,,,,,,,,,,
45,True,grt,GRT - The Graph,https://github.com/graphprotocol,Indexing protocol and global API for organizing blockchain data and making it easily accessible with GraphQL...,web3,5,False,8424.0,,,,1.0,['eth'],,,,,,,,,,,,,,,,,,,,
46,True,zil,ZIL - Zilliqa,https://github.com/Zilliqa,Zilliqa will be the worlds first high-throughput public blockchain platform - designed to scale to thousands of..,smart-contract-platform,5,False,17900.0,,,,2.0,,,,,,,,,,,,,,,,,,,,,
47,True,waxp,WAXP - WAX,https://github.com/worldwide-asset-exchange,WAX - Worldwide Asset eXchange Its a decentralized platform that enables anyone to operate a fully functioning virtual..,metaverse,5,False,13288.0,,,,1.0,,,,,,,,,,,,,,,,,,,,,
48,True,zrx,ZRX - 0x,https://github.com/0xProject,"An Open Protocol For Decentralized Exchange On The Ethereum Blockchain 0x is an open, permissionless protocol allowing..",exchange-tokens,5,False,9260.666666666666,,,,1.0,['eth'],,,,,,,,,,,,,,,,,,,,
49,True,uma,UMA - UMA,https://github.com/UMAprotocol,Decentralized financial contracts platform built to enable Universal Market Access.,defi,5,False,9288.0,,,,1.0,['eth'],,,,,,,,,,,,,,,,,,,,
50,True,ckb,CKB - Nervos Network,https://github.com/nervosnetwork,"Nervos CKByte (Common Knowledge Byte) is the native token of the Nervos Common Knowledge Base, a multi-asset, store of..",others,5,False,57551.33333333335,,,,1.0,,,,,,,,,,,,,,,,,,,,,
51,True,dydx,DYDX - dYdX,https://github.com/dydxfoundation,"With an industry-leading product and a strong trajectory of organic growth, the dYdX Layer 2 protocol is ready for the..",exchange-tokens,5,False,31770.0,,,,1.0,['eth'],,,,,,,,,,,,,,,,,,,,
52,True,movr,MOVR - Moonriver,https://github.com/PureStake,Fully Ethereum-compatible smart contract parachain on Kusama. Due to this Ethereum-like design and developer-friendly..,smart-contract-platform,5,False,27882.0,,,,2.0,,,,,,,,,,,,,,,,,,,,,
53,True,ant,ANT - Aragon,https://github.com/aragon,Aragon was born to bring transparency and independent governance to the forefront of managing an organization. We want..,web3,5,False,8644.0,,,,1.0,['eth'],,,,,,,,,,,,,,,,,,,,
54,True,ever,EVER - Everscale,https://github.com/tonlabs,"Fast, secure and scalable network with near-zero fees, which can process up to a million transactions per second..",others,5,False,11788.0,,,,1.0,,,,,,,,,,,,,,,,,,,,,
55,True,ocean,OCEAN - Ocean Protocol,https://github.com/oceanprotocol,A Decentralized Data Exchange Protocol to Unlock Data for AI.,web3,5,False,27264.0,,,,1.0,['eth'],,,,,,,,,,,,,,,,,,,,
56,True,lsk,LSK - Lisk,https://github.com/LiskHQ,Lisk makes it easy for developers to build and deploy blockchain applications in JavaScript. Develop and publish..,smart-contract-platform,5,False,19444.0,,,,2.0,,,,,,,,,,,,,,,,,,,,,
57,True,rgt,RGT - Rari Governance Token,https://github.com/Rari-Capital,The Rari Governance Token is the native token behind Rari Capital. Rari Capital is a non-custodial DeFi robo-advisor..,defi,5,False,36838.0,,,,1.0,['eth'],,,,,,,,,,,,,,,,,,,,
58,True,bico,BICO - Biconomy,https://github.com/bcnmy,Biconomy provides plug-n-play APIs to make web3.0 user-friendly & frictionless. We are on a mission to make the..,others,5,False,17688.0,,,,1.0,['eth'],,,,,,,,,,,,,,,,,,,,
59,True,req,REQ - Request,https://github.com/RequestNetwork,"A decentralized network built on top of Ethereum, which allows anyone, anywhere to request a payment.",defi,5,False,18826.0,,,,1.0,['eth'],,,,,,,,,,,,,,,,,,,,
60,True,erg,ERG - Ergo,https://github.com/ergoplatform,ERGOs platform is based on a variety of ideas that complement each other and aim to provide solutions for various..,privacy-coins,5,False,22795.333333333332,,,,1.0,,,,,,,,,,,,,,,,,,,,,
61,True,mngo,MNGO - Mango,https://github.com/blockworks-foundation,No description.,exchange-tokens,5,False,29968.0,,,,1.0,['sol'],,,,,,,,,,,,,,,,,,,,
62,True,kilt,KILT - KILT Protocol,https://github.com/KILTprotocol,"Open-source blockchain protocol for issuing verifiable, revocable, and anonymous claims-based credentials in Web 3.0...",web3,5,False,17580.0,,,,1.0,['dot'],,,,,,,,,,,,,,,,,,,,
63,True,rep,REP - Augur,https://github.com/AugurProject,Decentralized prediction market built on the Ethereum blockchain. It allows you to forecast events and be rewarded for..,defi,5,False,11702.0,,,,1.0,['eth'],,,,,,,,,,,,,,,,,,,,
64,True,kar,KAR - Karura,https://github.com/AcalaNetwork,"All-in-one DeFi hub of Kusama. Founded by the Acala Foundation, Karura is a scalable, EVM-compatible network optimized..",others,5,False,27338.0,,,,1.0,,,,,,,,,,,,,,,,,,,,,
65,True,xdata,XDATA - Streamr XDATA,https://github.com/streamr-dev,Unstoppable real-time data for unstoppable apps.,iot,5,False,14202.0,,,,1.0,['eth'],,,,,,,,,,,,,,,,,,,,
66,True,sbr,SBR - Saber,https://github.com/saber-hq,Cross-chain stablecoin exchange on Solana.,exchange-tokens,5,False,34146.0,,,,1.0,,,,,,,,,,,,,,,,,,,,,
67,True,orca,ORCA - Orca,https://github.com/orca-so,Most user-friendly DEX on Solana. Orca is one of the first general-purpose AMMs launched on Solana. Users can swap..,exchange-tokens,5,False,18478.0,,,,1.0,['sol'],,,,,,,,,,,,,,,,,,,,
68,True,hopr,HOPR - HOPR,https://github.com/hoprnet,HOPR provides essential and compliant network-level metadata privacy for everyone. HOPR is an open incentivized mixnet..,privacy-coins,5,False,8674.0,,,,1.0,['eth'],,,,,,,,,,,,,,,,,,,,
69,True,mta,MTA - mStable Governance Token: Meta,https://github.com/mstable,The Meta token aims to coordinate decentralised governance by incentivising stakeholders to act in the best interests..,defi,5,False,9314.0,,,,1.0,['eth'],,,,,,,,,,,,,,,,,,,,
70,True,san,SAN - Santiment Network Token,https://github.com/santiment,"A Better Way to Trade Crypto-Markets Market Datafeeds, Newswires, and Crowd Sentiment Insights for the Blockchain World.",web3,5,False,19038.0,,,,1.0,['eth'],,,,,,,,,,,,,,,,,,,,
71,True,tnt,TNT - Tierion,https://github.com/tierion,"Use the blockchain as a global platform to verify any data, file, or business process. Developer tools & API to anchor..",others,5,False,39976.0,,,,1.0,['eth'],,,,,,,,,,,,,,,,,,,,
72,True,dfi,DFI - Amun DeFi Index,https://github.com/DeFiCh,DeFi Blockchain - bringing DeFi to Bitcoin.,defi,5,False,27788.0,,,,1.0,['eth'],,,,,,,,,,,,,,,,,,,,
73,True,xym,XYM - Symbol,https://github.com/symbol,"Trusted and secure enterprise blockchain that smooths business friction, increasing the flow of data and innovation to..",others,5,False,15246.0,,,,1.0,,,,,,,,,,,,,,,,,,,,,
74,True,btrst,BTRST - Braintrust,https://github.com/snowfork,"First decentralized talent network that connects skilled, vetted knowledge workers with the worlds most reputable..",web3,5,False,25536.0,,,,1.0,['eth'],,,,,,,,,,,,,,,,,,,,
75,True,wncg,WNCG - Wrapped NCG,https://github.com/planetarium,"Open source, decentralized RPG network powered by the community. As a fully decentralized game, there are no servers,..",metaverse,5,False,27250.0,,,,1.0,['eth'],,,,,,,,,,,,,,,,,,,,
76,True,sc,SC - Siacoin,https://github.com/siafoundation,First decentralized storage platform secured by blockchain technology. The Sia Storage Platform leverages..,web3,4,False,1204.0,,,,2.0,,,,,,,,,,,,,,,,,,,,,
77,True,nmr,NMR - Numeraire,https://github.com/numerai,Numeraire: A Cryptographic Token for Coordinating Machine Intelligence and Preventing Overfitting.,defi,4,False,1352.0,,,,1.0,['eth'],,,,,,,,,,,,,,,,,,,,
78,True,lpt,LPT - Livepeer,https://github.com/livepeer,"Open Source Video Infrastructure Services, Built On The Ethereum Blockchain. For video engineers who need affordable,..",web3,4,False,1526.0,,,,2.0,['eth'],,,,,,,,,,,,,,,,,,,,
79,True,comp,COMP - Compound,https://github.com/compound-finance,"Created by the Compound Finance Team, Compound Governance Token (COMP) or (sometimes verbally Compound Coin) will be..",defi,4,False,3344.0,,,,1.0,['eth'],,,,,,,,,,,,,,,,,,,,
80,True,egld,EGLD - Elrond,https://github.com/ElrondNetwork,"Technology ecosystem for the new internet. Its smart contracts execution platform is capable of 15,000 TPS, 5s latency..",smart-contract-platform,4,False,2184.0,,,,2.0,,,,,,,,,,,,,,,,,,,,,
81,True,mkr,MKR - Maker,https://github.com/makerdao,"Utility token, governance token and recapitalization resource of the Maker system.",defi,4,False,5460.0,,,,1.0,['eth'],-1.0,,,,,,,,,,,,,,,,,,,
82,True,kda,KDA - Kadena,https://github.com/kadena-io,"Braided, parallelized Proof Of Work consensus mechanism that improves throughput and scalability while maintaining the..",smart-contract-platform,4,False,2170.0,,,,2.0,,,,,,,,,,,,,,,,,,,,,
83,True,mina,MINA - Mina Protocol,https://github.com/MinaProtocol,"The worlds lightest blockchain, powered by participants. Mina is building a privacy-preserving gateway between the..",others,4,False,7580.0,,,,2.0,,,,,,,,,,,,,,,,,,,,,
84,True,rdn,RDN - Raiden Network Token,https://github.com/raiden-network,"Off-chain scaling solution, enabling near-instant, low-fee and scalable payments. Its complementary to the Ethereum..",web3,4,False,2610.0,,,,2.0,['eth'],,,,,,,,,,,,,,,,,,,,
85,True,omg,OMG - OMG Network,https://github.com/omgnetwork,"Scaling solution for finance on Ethereum, enabling transparent, peer-to-peer transactions in real-time. The..",smart-contract-platform,4,False,2042.0,,,,2.0,['eth'],,,,,,,,,,,,,,,,,,,,
86,True,audio,AUDIO - Audius,https://github.com/AudiusProject,"Native platform token of the Audius streaming protocol. AUDIO is staked for security, feature access and governance..",metaverse,4,False,3976.0,,,,2.0,['eth'],,,,,,,,,,,,,,,,,,,,
87,True,anc,ANC - Anchor Protocol,https://github.com/Anchor-Protocol,"Unique decentralized peer to peer internet cryptocurrency that provides for its users. I2P and Tor compatible, it is..",defi,4,False,6299.333333333333,,,,1.0,['luna'],,,,,,,,,,,,,,,,,,,,
88,True,ont,ONT - Ontology,https://github.com/ontio,New high-performance public blockchain project & a distributed trust collaboration platform. Ontology provides new..,smart-contract-platform,4,False,3256.0,,,,2.0,,,,,,,,,,,,,,,,,,,,,
89,True,ren,REN - REN,https://github.com/renproject,A decentralized dark pool for trustless cross-chain atomic trading of cryptocurrencies.,exchange-tokens,4,False,3012.0,,,,2.0,['eth'],,,,,,,,,,,,,,,,,,,,
90,True,glm,GLM - Golem,https://github.com/golemfactory,"Global, open source, decentralized supercomputer that anyone can access. It is made up of the combined power of users..",web3,4,False,1520.0,,,,2.0,['eth'],,,,,,,,,,,,,,,,,,,,
91,True,nu,NU - NuCypher,https://github.com/nucypher,Privacy layer for distributed systems and decentralized applications. NuCypher KMS helps dApp developers secure their..,privacy-coins,4,False,3232.0,,,,1.0,['eth'],,,,,,,,,,,,,,,,,,,,
92,True,keep,KEEP - Keep Network,https://github.com/keep-network,A privacy layer for Ethereum. A keep is an off-chain container for private data. Keeps help contracts harness the full..,privacy-coins,4,False,6690.0,,,,1.0,['eth'],,,,,,,,,,,,,,,,,,,,
93,True,fet,FET - Fetch.ai,https://github.com/fetchai,Next-generation protocol built with a ready-to-go Useful Proof of Work system invented by world-leading AI minds.,metaverse,4,False,2010.0,,,,2.0,['eth'],,,,,,,,,,,,,,,,,,,,
94,True,cspr,CSPR - Casper Network,https://github.com/casper-ecosystem,First live proof-of-stake blockchain built off the Casper CBC specification. Casper is designed to accelerate..,smart-contract-platform,4,False,3343.3333333333335,,,,2.0,,,,,,,,,,,,,,,,,,,,,
95,True,ewt,EWT - Energy Web Token,https://github.com/energywebfoundation,"Native token of the Energy Web Chain, a public, Proof-of-Authority Ethereum Virtual Machine blockchain specifically..",others,4,False,4572.0,,,,2.0,,,,,,,,,,,,,,,,,,,,,
96,True,dusk,DUSK - DUSK Network,https://github.com/dusk-network,Open-source and privacy-oriented blockchain based on years of academic research. You can use Dusk Network to create..,privacy-coins,4,False,4940.666666666667,,,,1.0,['eth'],,,,,,,,,,,,,,,,,,,,
97,True,joe,JOE - JOE,https://github.com/traderjoe-xyz,Trader Joe is your one-stop decentralized trading platform on the Avalanche network. We combine DEX services with DeFi..,exchange-tokens,4,False,3824.0,,,,2.0,['avax'],,,,,,,,,,,,,,,,,,,,
98,True,cfx,CFX - Conflux,https://github.com/Conflux-Chain,"Open protocol for a new world of DApps, finance, and Web 3.0. As a fast and secure public blockchain, Conflux Network..",smart-contract-platform,4,False,7792.0,,,,2.0,,,,,,,,,,,,,,,,,,,,,
99,True,rmrk,RMRK - RMRK,https://github.com/rmrk-team,"Most advanced nft system in the world, adding eternal liquidity and multi chain forward compatibility to all NFT..",metaverse,4,False,3580.0,,,,2.0,,,,,,,,,,,,,,,,,,,,,
100,True,twt,TWT - Trust Wallet Token,https://github.com/trustwallet,Trust Wallet Token (TWT) 511 is a utility token that can only be used within the app. This will be used to incentivize..,exchange-tokens,4,False,5842.0,,,,2.0,['bsc'],,,,,,,,,,,,,,,,,,,,
101,True,rlc,RLC - iExec RLC,https://github.com/iExecBlockchainComputing,The First Decentralized Marketplace for Cloud Resources.,web3,4,False,7656.0,,,,2.0,['eth'],,,,,,,,,,,,,,,,,,,,
102,True,bzz,BZZ - Swarm,https://github.com/ethersphere,System of peer-to-peer networked nodes that create a decentralised storage and communication service. The system is..,others,4,False,3766.0,,,,2.0,['eth'],,,,,,,,,,,,,,,,,,,,
103,True,steem,STEEM - Steem,https://github.com/steemit,"A new way for publishers to monetize their online content and community, based on battle-tested blockchain technology...",cryptocurrency,4,False,3086.0,,,,2.0,,,,,,,,,,,,,,,,,,,,,
104,True,astro,ASTRO - Astroport,https://github.com/astroport-fi,Next generation AMM on Terra chain. It offers multiple pool types ranging from Uniswap like xyk pools to stableswap..,others,4,False,2196.0,,,,2.0,['luna'],,,,,,,,,,,,,,,,,,,,
105,True,dpi,DPI - DeFi Pulse Index,https://github.com/SetProtocol,Capitalization-weighted index that tracks the performance of decentralized financial assets across the market...,defi,4,False,1372.0,,,,1.0,['eth'],,,,,,,,,,,,,,,,,,,,
106,True,hns,HNS - Handshake,https://github.com/handshake-org,Decentralized naming and certificate authority.,web3,4,False,3290.666666666667,,,,2.0,,,,,,,,,,,,,,,,,,,,,
107,True,mln,MLN - Enzyme,https://github.com/enzymefinance,Private company building the open-source Melon Protocol. The Enzyme is a blockchain protocol for digital asset..,defi,4,False,2108.0,,,,1.0,['eth'],,,,,,,,,,,,,,,,,,,,
108,True,bts,BTS - BitShares,https://github.com/bitshares,"Public, blockchain-based, real-time financial platform. It provides a decentralised asset exchange. BTS is a..",exchange-tokens,4,False,3722.0,,,,2.0,,,,,,,,,,,,,,,,,,,,,
109,True,mft,MFT - Hifi Finance,https://github.com/MainframeHQ,"Platform for decentralized applications. Resistant to censorship, surveillance, and disruption, the Mainframe network..",smart-contract-platform,4,False,1240.0,,,,2.0,['eth'],,,,,,,,,,,,,,,,,,,,
110,True,dock,DOCK - Dock,https://github.com/docknetwork,Special purpose decentralized data exchange protocol. This protocol is intended to incentivize the exchange of work..,web3,4,False,3616.0,,,,2.0,,,,,,,,,,,,,,,,,,,,,
