,group,group_id,name,homepage,description,category,projectrank,show,monthly_downloads,release_count,created_at,updated_at,projectrank_placing,labels,trending,github_id,conda_id,pypi_id,pypi_url,pypi_monthly_downloads,conda_url,conda_latest_release_published_at,conda_total_downloads,npm_id,maven_id,npm_url,npm_monthly_downloads,maven_url,cargo_id,cargo_url,cargo_monthly_downloads,cargo_total_downloads,go_id,go_url
469,True,mrx,MRX - Metrix Coin,https://github.com/TheLindaProjectInc,Metrix Coin (formerly Lindacoin) is a Proof of Stake digital currency. Metrix is a blockchain governed by the Metroid..,smart-contract-platform,1,False,,,,,3.0,,,,,,,,,,,,,,,,,,,,,
470,True,duck,DUCK - DLP Duck Token,https://github.com/unitprotocol,DuckDAO DeFi Market Maker protocol that will provide an opportunity for yield farmers to take advantage of the new..,others,1,False,,,,,3.0,['eth'],,,,,,,,,,,,,,,,,,,,
471,True,mtx,MTX - MATRYX,https://github.com/matryx,Decentralized VR platform on the blockchain. The Matryx Token Sale begins on September 6 with a public pre-sale. The..,others,1,False,,,,,3.0,['eth'],,,,,,,,,,,,,,,,,,,,
472,True,yam,YAM - YAM,https://github.com/yam-finance,No description.,defi,1,False,,,,,2.0,['eth'],,,,,,,,,,,,,,,,,,,,
473,True,man,MAN - Matrix AI Network,https://github.com/MatrixAINetwork,"Designed to be the new generation blockchain, MATRIX leverages the latest artificial intelligence technology to..",web3,1,False,,,,,2.0,['eth'],,,,,,,,,,,,,,,,,,,,
474,True,cmt,CMT - CyberMiles,https://github.com/cybermiles,CyberMiles is Empowering the Decentralization of E-commerce.,others,1,False,,,,,3.0,['eth'],,,,,,,,,,,,,,,,,,,,
475,True,xpm,XPM - Primecoin,https://github.com/primecoin,"Innovative cryptocurrency, a form of digital currency secured by cryptography and issued through a decentralized..",others,1,False,,,,,3.0,,,,,,,,,,,,,,,,,,,,,
476,True,html,HTML - HTMLCOIN,https://github.com/HTMLCOIN,The HTMLCOIN Foundation drives innovation by empowering users to deliver amazing blockchain applications. Based on..,metaverse,1,False,,,,,2.0,,,,,,,,,,,,,,,,,,,,,
477,True,true,TRUE - TrueChain,https://github.com/truechain,"TrueChain is fast, permissionless, secure and scalable public blockchain platform which is supported by hybrid..",smart-contract-platform,1,False,,,,,3.0,,,,,,,,,,,,,,,,,,,,,
478,True,plr,PLR - Pillar,https://github.com/pillarwallet,We are building the worlds best cryptocurrency and token wallet that will become the dashboard for your digital life.,defi,1,False,,,,,2.0,['eth'],,,,,,,,,,,,,,,,,,,,
479,True,node,NODE - DAppNode,https://github.com/dappnode,Smart nodes on the chain where Acute angle blockchain smartphones deliver behavioral value benefit everyone from..,others,1,False,,,,,3.0,['eth'],,,,,,,,,,,,,,,,,,,,
480,True,etho,ETHO - Etho Protocol,https://github.com/Ether1Project,Ethereum based blockchain that integrates POW and a three tier masternode system to secure the network. Etho Protocol..,web3,1,False,,,,,2.0,,,,,,,,,,,,,,,,,,,,,
481,True,gnx,GNX - Genaro Network,https://github.com/GenaroNetwork,The purpose of the Genaro project is to build a trusted and decentralized storage using blockchain technology. Users..,web3,1,False,,,,,2.0,['eth'],,,,,,,,,,,,,,,,,,,,
482,True,zap,ZAP - Zap,https://github.com/zapproject,Zap wants to build an open marketplace for data feeds that can be oraclized to connect to smart contracts and..,defi,1,False,,,,,2.0,['eth'],,,,,,,,,,,,,,,,,,,,
483,True,grc,GRC - Gridcoin,https://github.com/gridcoin-community,Cryptocurrency which rewards volunteer distributed computation performed on the BOINC platform on top of Proof of Stake.,others,1,False,,,,,3.0,,,,,,,,,,,,,,,,,,,,,
484,True,hpb,HPB - High Performance Blockchain,https://github.com/hpb-project,"HPB (High-Performance Blockchain) is a new kind of blockchain hardware and software architecture, which includes a..",cryptocurrency,1,False,,,,,2.0,['eth'],,,,,,,,,,,,,,,,,,,,
485,True,aur,AUR - Auroracoin,https://github.com/aurarad,"Peer-to-peer cryptocurrency launched on January 24, 2014 as an Icelandic alternative to bitcoin and the Icelandic..",others,1,False,,,,,3.0,,,,,,,,,,,,,,,,,,,,,
486,True,ccx,CCX - Conceal,https://github.com/ConcealNetwork,"Private, scalability-focused, untraceable, secure, and fungible cryptocurrency with a decentralised banking system.",defi,1,False,,,,,2.0,,,,,,,,,,,,,,,,,,,,,
487,True,cpc,CPC - CPChain,https://github.com/cpchain,New distributed infrastructure for next generation IoT. CPChain intends to build a fundamental data platform for IoT..,web3,1,False,,,,,2.0,['eth'],,,,,,,,,,,,,,,,,,,,
488,True,btcp,BTCP - Bitcoin Pro,https://github.com/BTCPrivate,Hard fork of Zclassic and Bitcoin. Codebase is based on Zcash and Zk-snarks.,cryptocurrency,1,False,,,,,2.0,['eth'],,,,,,,,,,,,,,,,,,,,
489,True,trtl,TRTL - TurtleCoin,https://github.com/turtlecoin,"Fun, fast, and easy way to send money to friends and businesses.",privacy-coins,1,False,,,,,2.0,,,,,,,,,,,,,,,,,,,,,
490,True,ftc,FTC - Feathercoin,https://github.com/FeatherCoin,"Upgraded and customised version of Bitcoin. Feathercoin was born with the intent to expand, experiment, and build onto..",metaverse,1,False,,,,,2.0,,,,,,,,,,,,,,,,,,,,,
491,True,masq,MASQ - MASQ,https://github.com/MASQ-Project,Foundation for the internet of the future. MASQ is much more than just another blockchain VPN - its a leading-edge..,others,1,False,,,,,3.0,['eth'],,,,,,,,,,,,,,,,,,,,
492,True,ndx,NDX - Indexed Finance,https://github.com/indexed-finance,"Blockchain business development start up that that seeks to provide for the entire blockchain community, robust..",defi,1,False,,,,,2.0,['eth'],,,,,,,,,,,,,,,,,,,,
493,True,vbk,VBK - VeriBlock,https://github.com/VeriBlock,VeriBlock.,others,1,False,,,,,3.0,,,,,,,,,,,,,,,,,,,,,
494,True,emc,EMC - EmerCoin,https://github.com/emercoin,Emercoin - Distributed blockchain services for business and personal use.,others,1,False,,,,,3.0,,,,,,,,,,,,,,,,,,,,,
495,True,blk,BLK - BlackCoin,https://github.com/CoinBlack,"Peer-to-peer cryptocurrency, which uses only proof-of-stake consensus mechanism.",others,1,False,,,,,3.0,,,,,,,,,,,,,,,,,,,,,
496,True,ess,ESS - Essentia,https://github.com/essentiaone,Masternoded multi-chained set of protocols connecting centralized and decentralized resources to create new powerful..,others,1,False,,,,,3.0,['eth'],,,,,,,,,,,,,,,,,,,,
497,True,dos,DOS - DOS Network,https://github.com/DOSNetwork,A Decentralized Oracle Service Network to Boost Blockchain Usability with Real World Data and Computation Power.,others,1,False,,,,,3.0,['eth'],,,,,,,,,,,,,,,,,,,,
498,True,xcash,XCASH - X-CASH,https://github.com/X-CASH-official,Community driven project providing the toolbox for the next stage of the web. The open-source X-Cash Project is..,defi,1,False,,,,,2.0,,,,,,,,,,,,,,,,,,,,,
499,True,xmy,XMY - Myriad,https://github.com/myriadteam,Myriad - A Coin For Everyone. Myriad is the first Multi-Algo coin. Correct implementation of Multi-Algo leads to..,others,1,False,,,,,3.0,,,,,,,,,,,,,,,,,,,,,
500,True,ost,OST - OST,https://github.com/OpenST,Protocol for consumer-app tokenization and an ERC-20 utility token that enables any app to launch branded tokens on..,others,1,False,,,,,3.0,['eth'],,,,,,,,,,,,,,,,,,,,
501,True,ares,ARES - Ares Protocol,https://github.com/aresprotocols,On-chain-verified oracle protocol that provides secure and reliable data services for the Polkadot DeFi ecosystem.,smart-contract-platform,1,False,,,,,3.0,['eth'],,,,,,,,,,,,,,,,,,,,
502,True,adm,ADM - ADAMANT Messenger,https://github.com/adamant-im,"Decentralized anonymous messenger based on the blockchain system. Its independent of any governments or corporations,..",others,1,False,,,,,3.0,,,,,,,,,,,,,,,,,,,,,
503,True,omni,OMNI - Omni,https://github.com/OmniLayer,Platform for creating and trading custom digital assets and currencies. It is a software layer built on top of the..,smart-contract-platform,1,False,,,,,3.0,,,,,,,,,,,,,,,,,,,,,
504,True,wdgld,WDGLD - Wrapped-DGLD,https://github.com/commerceblock,"First ERC-20 token pegged one-to-one with DGLD, the worlds most advanced and trusted gold-backed stablecoin built on..",others,1,False,,,,,3.0,['eth'],,,,,,,,,,,,,,,,,,,,
505,True,cloak,CLOAK - Cloakcoin,https://github.com/CloakProject,"Cloak provides a fast, fully private, secure, untraceable and user friendly transaction system with guaranteed..",privacy-coins,1,False,,,,,2.0,,,,,,,,,,,,,,,,,,,,,
506,True,cofi,COFI - CoFiX,https://github.com/coinfi,"CoinFi offers crowdsourced and professionally curated research, analysis, trading signals, trading algorithms, and..",exchange-tokens,1,False,,,,,2.0,['eth'],,,,,,,,,,,,,,,,,,,,
507,True,sin,SIN - Sin City,https://github.com/SINOVATEblockchain,SUQA created its own brand new X22i POW algorithm for its blockchain to be available to the average ordinary CPU and..,metaverse,1,False,,,,,2.0,['bsc'],,,,,,,,,,,,,,,,,,,,
508,True,ryo,RYO - Ryo Currency,https://github.com/ryo-currency,"Ryo is created with a high level of privacy in mind, setting Ring Confidential Transactions (RingCT) with minimum..",privacy-coins,1,False,,,,,2.0,,,,,,,,,,,,,,,,,,,,,
509,True,drt,DRT - DomRaider,https://github.com/Domraider,We aim at developing innovative solutions. DomRaider is the bridge between the world of assets and the potential of..,metaverse,1,False,,,,,2.0,['eth'],,,,,,,,,,,,,,,,,,,,
510,True,bac,BAC - Basis Cash,https://github.com/Basis-Cash,Fairly distributed & censorship resistant stablecoin with an algorithmic central bank.,defi,1,False,,,,,2.0,['eth'],,,,,,,,,,,,,,,,,,,,
511,True,dav,DAV - DAV Network,https://github.com/DAVFoundation,Open source Software platform that allows anyone to buy or sell transportation services in a decentralized market. DAV..,others,1,False,,,,,3.0,['eth'],,,,,,,,,,,,,,,,,,,,
512,True,nftfy,NFTFY - Nftfy,https://github.com/nftfy,Decentralized Application that provides the fractionalization of Non-Fungible Tokens. It is the trustless way of..,metaverse,1,False,,,,,2.0,['eth'],,,,,,,,,,,,,,,,,,,,
513,True,ddd,DDD - Scry.info,https://github.com/scryInfo,"Worlds first blockchain-based quantifiable data exchange platform for real data storage, validation, sharing, analysis..",web3,1,False,,,,,2.0,['eth'],,,,,,,,,,,,,,,,,,,,
514,True,ugas,UGAS - Ultrain,https://github.com/ultrain-os,Ultrain Technology Limited is the next generation public-blockchain technology venture that focuses on building a high..,web3,1,False,,,,,2.0,['eth'],,,,,,,,,,,,,,,,,,,,
515,True,xla,XLA - Scala,https://github.com/scala-network,"Redistribution of wealth using the power of blockchain a completely decentralized, private, and modern cryptocurrency.",privacy-coins,1,False,,,,,2.0,,,,,,,,,,,,,,,,,,,,,
516,True,ok,OK - OKCash,https://github.com/okcashpro,Hybrid cryptocurrency that started with PoW mining on November 2014 to then turn into a full Proof of stake currency.,others,1,False,,,,,3.0,,,,,,,,,,,,,,,,,,,,,
517,True,mintme,MINTME - MintMe.com Coin,https://github.com/mintme-com,"Transparent web-mineable blockchain platform made to support Decentralized Applications (DApps), where websites can..",cryptocurrency,1,False,,,,,2.0,,,,,,,,,,,,,,,,,,,,,
518,True,phr,PHR - Phore,https://github.com/phoreproject,"Phore Blockchain enables the transfer of value (currency: Phore) across an accessible, standardized ecosystem that is..",privacy-coins,1,False,,,,,2.0,,,,,,,,,,,,,,,,,,,,,
519,True,zcl,ZCL - Zclassic,https://github.com/ZClassicCommunity,"Fork of Zcash, developer decided to take another path by removing the 20% fee. Miners are simply earning their fair..",privacy-coins,1,False,,,,,2.0,,,,,,,,,,,,,,,,,,,,,
520,True,meme,MEME - Meme,https://github.com/pepeteam,Native token to the exclusive digital art NFT platform DontBuyMEME. The platform hosts digital artists from around the..,metaverse,1,False,,,,,2.0,['eth'],,,,,,,,,,,,,,,,,,,,
521,True,nbx,NBX - Netbox Coin,https://github.com/netboxglobal,"The first decentralized web browser with integrated blockchain node. Includes Netbox.Wallet, which is credited with..",web3,1,False,,,,,2.0,,,,,,,,,,,,,,,,,,,,,
522,True,sake,SAKE - SakeToken,https://github.com/Sakeswap,First governance token in DeFi that supports both spot market and futures market with SakeSwap AMM DEX and SakePerp..,exchange-tokens,1,False,,,,,2.0,['eth'],,,,,,,,,,,,,,,,,,,,
523,True,klp,KLP - Kulupu,https://github.com/kulupu,No description.,smart-contract-platform,1,False,,,,,3.0,,,,,,,,,,,,,,,,,,,,,
524,True,evx,EVX - Everex,https://github.com/EverexIO,"Financial technology company specializing in applying blockchain solutions to cross-border payments, trading and..",defi,1,False,,,,,2.0,['eth'],,,,,,,,,,,,,,,,,,,,
525,True,dfd,DFD - DefiDollar DAO,https://github.com/defidollar,DFD is DefiDollars governance token in which holders will be able to participate in protocol governance and act as a..,defi,1,False,,,,,2.0,['eth'],,,,,,,,,,,,,,,,,,,,
526,True,appc,APPC - AppCoins,https://github.com/Aptoide,AppCoin tokens (APPC Tokens) are ERC-20 compatible tokens distributed on the Ethereum blockchain pursuant to a related..,others,1,False,,,,,3.0,['eth'],,,,,,,,,,,,,,,,,,,,
527,True,yaxis,YAXIS - yAxis,https://github.com/yaxis-project,Experiment in DAO-directed yield farming. Users will deposit stable coins and take advantage of the best yield..,defi,1,False,,,,,2.0,['eth'],,,,,,,,,,,,,,,,,,,,
528,True,mars,MARS - Mars,https://github.com/marscoin,The protocol consists of pBTC35A tokens and MARS tokens. Each pBTC35A token represents 1TH/s hashrate with pre-..,others,1,False,,,,,3.0,['eth'],,,,,,,,,,,,,,,,,,,,
529,True,daps,DAPS - DAPS Coin,https://github.com/DAPSCoin,"Fully private blockchain with a focus on security, scalability and total privacy. The goal of DAPS protocol is to..",privacy-coins,1,False,,,,,2.0,,,,,,,,,,,,,,,,,,,,,
530,True,red,RED - Red,https://github.com/red,The Red community is building the worlds first fullstack and blockchain language. RED tokens will drive the..,exchange-tokens,1,False,,,,,2.0,['eth'],,,,,,,,,,,,,,,,,,,,
531,True,2key,2KEY - 2key.network,https://github.com/2key,REAL technology.,others,1,False,,,,,3.0,['eth'],,,,,,,,,,,,,,,,,,,,
532,True,pht,PHT - Lightstreams Photon,https://github.com/lightstreams-network,"The award-winning decentralized network for fast, privacy-enabled blockchain applications. With secure private file..",smart-contract-platform,1,False,,,,,3.0,,,,,,,,,,,,,,,,,,,,,
533,True,ss,SS - Sharder protocol,https://github.com/Sharders,"A cross-chain distributed storage protocol based on blockchain 3.0. It could be deployed on all public chains, storage..",web3,1,False,,,,,2.0,['eth'],,,,,,,,,,,,,,,,,,,,
534,True,arq,ARQ - ArQmA,https://github.com/arqma,"Decentralized public project of block chains, crypto currencies, and is fully open source. The team of programmers..",cryptocurrency,1,False,,,,,2.0,,,,,,,,,,,,,,,,,,,,,
535,True,rem,REM - Remme,https://github.com/Remmeauth,No more passwords no more break-ins. REMME implements foolproof user authentication to protect from cyber attacks..,others,1,False,,,,,3.0,['eth'],,,,,,,,,,,,,,,,,,,,
536,True,air,AIR - AirCoin,https://github.com/Aircoin-official,"The Air Coin(AIR) project was issued to mock the madness of the cryptocurrency market. After buying Air Coin, you get..",others,1,False,,,,,3.0,['bsc'],,,,,,,,,,,,,,,,,,,,
537,True,ptn,PTN - PalletOneToken,https://github.com/PalletOne,Cross-chain project which is also the widely discussed area of blockchain technology. With the continuously emergency..,others,1,False,,,,,3.0,['eth'],,,,,,,,,,,,,,,,,,,,
538,True,qwc,QWC - Qwertycoin,https://github.com/qwertycoin-org,"Decentralized peer-to-peer protocol for safe, seamless, secure & stealth payments worldwide.",cryptocurrency,1,False,,,,,2.0,,,,,,,,,,,,,,,,,,,,,
539,True,uuu,UUU - U Network,https://github.com/U-Network,U Network - will be a Decentralized Protocol for Publishing and Valuing Online Content.,smart-contract-platform,1,False,,,,,3.0,['eth'],,,,,,,,,,,,,,,,,,,,
540,True,hydro,HYDRO - Hydro,https://github.com/HydroBlockchain,Hydro enables private financial systems to seamlessly leverage the public blockchain. Cloud applications throughout..,exchange-tokens,1,False,,,,,2.0,['eth'],,,,,,,,,,,,,,,,,,,,
541,True,bunny,BUNNY - Pancake Bunny,https://github.com/PancakeBunny-finance,Compound Yields on Binance Smart Chain with Bunny. Bunny is continuously striving to create innovative new Yield..,defi,1,False,,,,,2.0,['bsc'],,,,,,,,,,,,,,,,,,,,
542,True,pasc,PASC - Pascal,https://github.com/PascalCoin,"PascalCoin pioneers a new tier of scalability suitable for planetary-scale adoption with a theoretical limit of 72,000..",others,1,False,,,,,3.0,,,,,,,,,,,,,,,,,,,,,
543,True,ut,UT - Ulord,https://github.com/UlordChain,Peer-to-peer value transfer public blockchain. Through building its blockchain underlying architecture and digital..,others,1,False,,,,,3.0,,,,,,,,,,,,,,,,,,,,,
544,True,dogec,DOGEC - DogeCash,https://github.com/dogecash,"Transparent, community-governed cryptocurrency for building high-quality platforms. Premine: 1M coins.",cryptocurrency,1,False,,,,,2.0,,,,,,,,,,,,,,,,,,,,,
545,True,dvt,DVT - DeVault,https://github.com/devaultcrypto,"The overarching goal of DeVault is to simply be social digital economy for everyone, with the spirit of..",cryptocurrency,1,False,,,,,2.0,,,,,,,,,,,,,,,,,,,,,
546,True,peg,PEG - PegNet,https://github.com/pegnet,Fully decentralized stablecoin / synthetic asset platform. Users can convert between any listed asset for just $.001..,others,1,False,,,,,3.0,,,,,,,,,,,,,,,,,,,,,
547,True,tie,TIE - Ties.DB,https://github.com/TiesNetwork,As a business tool Ties.Network will be a decentralized social platform where business professionals can connect and..,web3,1,False,,,,,2.0,['eth'],,,,,,,,,,,,,,,,,,,,
548,True,msr,MSR - Masari,https://github.com/masari-project,"Scalability-focused, untraceable, secure, and fungible cryptocurrency using the RingCT protocol.",privacy-coins,1,False,,,,,2.0,,,,,,,,,,,,,,,,,,,,,
549,True,scr,SCR - Scorum,https://github.com/Scorum,Blogging platform that rewards its active users.,others,1,False,,,,,3.0,,,,,,,,,,,,,,,,,,,,,
550,True,upx,UPX - uPlexa,https://github.com/uPlexa,Anonymity and eCommerce via IoT. Incentivizing the mass computing power of IoT devices to form a means of anonymous..,cryptocurrency,1,False,,,,,2.0,,,,,,,,,,,,,,,,,,,,,
551,True,music,MUSIC - NFTMusic.ai,https://github.com/musicoin,"Music streaming platform built on the blockchain that supports the creation, distribution and consumption of music in..",others,1,False,,,,,3.0,['bsc'],,,,,,,,,,,,,,,,,,,,
552,True,grft,GRFT - Graft Blockchain,https://github.com/graft-project,Accept cryptocurrency at the Point of Sale Merchants are rushing to accept cryptocurrency as a way to combat high..,others,1,False,,,,,3.0,,,,,,,,,,,,,,,,,,,,,
553,True,etz,ETZ - Ether Zero,https://github.com/etherzero-org,New generation of smart contract platform (public chain) initiated by a group of professional and technical geeks. Its..,others,1,False,,,,,3.0,,,,,,,,,,,,,,,,,,,,,
554,True,mxt,MXT - MarteXcoin,https://github.com/martexcoin,No description.,others,1,False,,,,,3.0,,,,,,,,,,,,,,,,,,,,,
555,True,axe,AXE - Axe,https://github.com/axerunners,Decentralized cryptocurrency.,privacy-coins,1,False,,,,,2.0,,,,,,,,,,,,,,,,,,,,,
556,True,btdx,BTDX - Bitcloud,https://github.com/limxtec,BITCLOUD - DIGITAL CURRENCY.,others,1,False,,,,,3.0,,,,,,,,,,,,,,,,,,,,,
557,True,bkx,BKX - BANKEX,https://github.com/bankex,Blockchain platform with multifunctional smart contracts building Proof-of-Asset Protocol. BANKEX enables new sources..,defi,1,False,,,,,2.0,['eth'],,,,,,,,,,,,,,,,,,,,
558,True,$based,$BASED - Based Money,https://github.com/cryptoghoulz,DeFi game of chicken designed to shake out weak hands and yield the highest gains for those who understand the rules...,defi,1,False,,,,,2.0,['eth'],,,,,,,,,,,,,,,,,,,,
559,True,lbtc,LBTC - Lightning Bitcoin,https://github.com/lbtcio,Fully decentralized Internet-of-value protocol for global payments. The specific applications include peer-to-peer..,others,1,False,,,,,3.0,,,,,,,,,,,,,,,,,,,,,
560,True,bch,BCH - Bitcoin Cash,https://github.com/gcash,Cryptocurrency. It is a fork (a copy in a way) of Bitcoin (BTC). It was created in August 2017 as a result of a..,cryptocurrency,1,False,,,,,2.0,,,,,,,,,,,,,,,,,,,,,
561,True,toncoin,TONCOIN - The Open Network,https://github.com/newton-blockchain,The next gen network to unite all blockchains and the existing Internet.,others,1,False,,,,,3.0,['eth'],,,,,,,,,,,,,,,,,,,,
562,True,vega,VEGA - Vega Protocol,https://github.com/vegaprotocol,"Proof-of-stake blockchain, built on top of Tendermint, which makes it possible to trade derivatives on a decentralised..",defi,1,False,,,,,2.0,['eth'],,,,,,,,,,,,,,,,,,,,
563,True,ata,ATA - Automata,https://github.com/automata-network,Decentralized service protocol that provides middleware-like traceless privacy services for dApps on Ethereum and..,others,1,False,,,,,3.0,['eth'],,,,,,,,,,,,,,,,,,,,
564,True,ssv,SSV - SSV Network,https://github.com/bloxapp,"SSV promotes decentralization, security, and liveness across the Ethereum consensus layer and forms the foundation of..",others,1,False,,,,,3.0,['eth'],,,,,,,,,,,,,,,,,,,,
565,True,maro,MARO - Maro,https://github.com/ttceco,TTC provides a decentralized and token-incentivized blockcahin protocol for the next generation social networks.,others,1,False,,,,,3.0,['eth'],,,,,,,,,,,,,,,,,,,,
566,True,perl,PERL - PERL.eco,https://github.com/perlin-network,"A high-throughput, DAG-based protocol capable of powering any application.",smart-contract-platform,1,False,,,,,3.0,['eth'],,,,,,,,,,,,,,,,,,,,
567,True,dx,DX - DxChain Token,https://github.com/dxchainnetwork,Worlds first decentralized big data and machine learning network powered by a computing-centric blockchain. In other..,web3,1,False,,,,,2.0,['eth'],,,,,,,,,,,,,,,,,,,,
568,True,nmc,NMC - Namecoin,https://github.com/namecoin,"Experimental open-source technology which improves decentralization, security, censorship resistance, privacy, and..",others,1,False,,,,,3.0,,,,,,,,,,,,,,,,,,,,,
569,True,visr,VISR - Visor,https://github.com/visorfinance,"Interact with DeFi protocols through an NFT Enhancing the discovery, reputation, safety and programmability of on-..",defi,1,False,,,,,2.0,['eth'],,,,,,,,,,,,,,,,,,,,
570,True,agrs,AGRS - Agoras: Currency of Tau,https://github.com/idni,"Agoras will be a fully featured intelligent economy revolving around the production, distribution and pricing of..",smart-contract-platform,1,False,,,,,3.0,['eth'],,,,,,,,,,,,,,,,,,,,
571,True,clo,CLO - Callisto Network,https://github.com/ethereumcommonwealth,"Blockchain platform with its own cryptocurrency (CLO) that is based on Ethereum protocol, so any Callisto improvements..",cryptocurrency,1,False,,,,,2.0,,,,,,,,,,,,,,,,,,,,,
572,True,fo,FO - FIBOS,https://github.com/fibosio,Platform for creating and developing blockchain application ecosystems Makes it easy for you to create your own value..,others,1,False,,,,,3.0,,,,,,,,,,,,,,,,,,,,,
573,True,yoyow,YOYOW - YOYOW,https://github.com/yoyow-org,"YOYOW, named from You Own Your Own Words, is a blockchain-based network aiming to quantify participants contribution..",others,1,False,,,,,3.0,['eth'],,,,,,,,,,,,,,,,,,,,
574,True,sft,SFT - Safety,https://github.com/safex,Safex describes itself as a privacy-focused open-source decentralized marketplace platform on the native Safex..,others,1,False,,,,,3.0,['bsc'],,,,,,,,,,,,,,,,,,,,
575,True,tft,TFT - ThreeFold Token,https://github.com/threefoldtech,"What is ThreeFold (TFT)? Founded in 2016, ThreeFold is a fully comprehensive peer-to-peer Internet and Cloud stack..",web3,1,False,,,,,2.0,['bsc'],,,,,,,,,,,,,,,,,,,,
576,True,pai,PAI - Project Pai,https://github.com/projectpai,"A persons Personal Artificial Intelligence (PAI), is a verified intelligent 3D avatar that looks like you, sounds like..",web3,1,False,,,,,2.0,,,,,,,,,,,,,,,,,,,,,
577,True,wow,WOW - Wownero,https://github.com/wownero,"Privacy-centric memecoin that was fairly launched on April 1, 2018 with no pre-mine, stealth-mine or ICO. Wownero has..",privacy-coins,1,False,,,,,2.0,,,,,,,,,,,,,,,,,,,,,
578,True,cyc,CYC - Cyclone Protocol,https://github.com/cycloneprotocol,"Multi-chain, non-custodial, privacy-preserving protocol. Cyclone applies zkSNARKs to enable transactional privacy by..",others,1,False,,,,,3.0,,,,,,,,,,,,,,,,,,,,,
579,True,grlc,GRLC - Garlicoin,https://github.com/garlicoinorg,"Garlicoin formed on a few simple fundamentals - cheap and fast transactions, low barrier to entry and total focus on..",meme-tokens,1,False,,,,,2.0,,,,,,,,,,,,,,,,,,,,,
580,True,xfc,XFC - Football Coin,https://github.com/multichain,FootballCoin gives you the chance to showcase your managerial abilities by allowing you to create your perfect..,others,1,False,,,,,3.0,,,,,,,,,,,,,,,,,,,,,
581,True,dyn,DYN - Dynamic,https://github.com/duality-solutions,"Dynamic enables fast, secure, verifiable transfers of data using blockchain technology. Enabling third-party..",others,1,False,,,,,3.0,,,,,,,,,,,,,,,,,,,,,
582,True,gsc,GSC - Global Social Chain,https://github.com/gscsocial,GSC (Global Social Chain) wants to be the worlds first new generation of social networking chain that owns hundreds of..,others,1,False,,,,,3.0,['eth'],,,,,,,,,,,,,,,,,,,,
583,True,tup,TUP - Tenup,https://github.com/tenup-coin,"For Progress, Investment & Success.",cryptocurrency,1,False,,,,,2.0,,,,,,,,,,,,,,,,,,,,,
584,True,seele,SEELE - Seele,https://github.com/seeleteam,"Seele created Neural Consensus Algorithm. It transforms the consensus problem into an asynchronous request, processing..",web3,1,False,,,,,2.0,['eth'],,,,,,,,,,,,,,,,,,,,
585,True,dvp,DVP - Decentralized Vulnerability Platform,https://github.com/dvpnet,DVP (Decentralized Vulnerability Platform) is an international community of information security professionals (White..,others,1,False,,,,,3.0,['eth'],,,,,,,,,,,,,,,,,,,,
